id,case,title,creator,year,type,language,status,access,public_domain,notes
PB-P001,port-breton,La Nouvelle France,Marquis de Rays / colonial enterprise,,,French,,,,Years: 1879-1882 | Access: digital archive | Public domain: likely | Recruitment and propaganda newspaper for the colony. | SLQ record id: slq_alma99183978086302061; call number: RBS 919.5 004
PB-P002,port-breton,"Nouvelle-France: Colonie libre de Port-Breton, Océanie",Paul de Groote,,,French,,,,Years: 1879 | Access: digital/public domain | Public domain: likely | Promotional account useful for claims made to prospective settlers.
PB-P003,port-breton,L'aventure de Port-Breton et la colonie libre dite Nouvelle-France,A. Baudouin,,,French,,,,Years: 1883 | Access: library/public domain | Public domain: likely | Contemporary account near the time of the disaster.
PB-P004,port-breton,French trial and legal proceedings relating to the Marquis de Rays,various,,,French,,,,Years: 1880s | Access: archives/public domain | Public domain: likely | Core source for the fraud prosecution and official findings.
PB-P005,port-breton,Australian newspaper coverage in Trove,various,,,English,,,,"Years: 1880s | Access: digital/public domain | Public domain: likely | Coverage of survivors, trial, and New Italy settlement."
PB-P006,port-breton,New Italy Museum and survivor materials,various,,,English/Italian,,,,Years: various | Access: museum/archive | Public domain: mixed | Important for survivor families and Australian aftermath.
PB-S001,port-breton,L'Odyssée de Port-Breton ou le rêve océanien du marquis de Rays,Daniel Raphalen,,,French,,,,Years: 2006 | Access: purchase/used | Public domain: false | Likely definitive modern French monograph; difficult to acquire.
PB-S002,port-breton,The Phantom Paradise: The Story of the Expedition of the Marquis de Rays,Ugo Niau,,,English,,,,Years: 1936 | Access: library/used | Public domain: unknown | One of the few English-language book-length treatments.
